{
  "schemaVersion": "v1",
  "documentStatus": "COMPLETE",
  "merchantName": { "status": "present", "value": "Mercado Bom Preco", "confidence": "HIGH" },
  "purchasedAt": { "status": "present", "value": "2026-07-20T12:00:00Z", "confidence": "HIGH" },
  "total": { "status": "present", "value": 2599, "confidence": "HIGH" },
  "items": [
    {
      "description": { "status": "present", "value": "ARROZ BRANCO 5KG", "confidence": "HIGH" },
      "quantity": { "status": "present", "value": "1", "confidence": "HIGH" },
      "unit": { "status": "present", "value": "UN", "confidence": "MEDIUM" },
      "unitPrice": { "status": "present", "value": 2599, "confidence": "HIGH" },
      "totalPrice": { "status": "present", "value": 2599, "confidence": "HIGH" }
    }
  ]
}
